"ID","Country","Categoria","Settore","Prodotto eng","Prodotto","Confezione","Prezzo","Photo",,"Esclusivo","Obsoleto","IDDestinatario","COGE","Note","QuantDef"
"CBP001","Italy","Penne, accessori","Correttori","Correttore a nastro","Correttore a nastro",1,"1.41","Correttore-a-nastro.jpg",,FALSO,FALSO,"SMR","N010",,
"CBP002","Italy","Penne, accessori","Correttori","Corr. liquido Multifluid 20 ml.","Corr. liquido Multifluid 20 ml.",1,"0.44","Corr.-liquido-Multifluid-20-ml.jpg",,FALSO,FALSO,"SMR","N010",,
"CBP003","Italy","Penne, accessori","Correttori","Correttore a penna","Correttore a penna",1,"2.52","Correttore-a-penna.jpg",,FALSO,FALSO,"SMR","N010",,
"CBP004","Italy","Penne, accessori","Evidenziatori, marcatori","Evidenziatore verde","Evidenziatore verde",10,"0.95","Evidenziatore.jpg",,FALSO,FALSO,"SMR","N010",,
"CBP005","Italy","Penne, accessori","Evidenziatori, marcatori","Evidenziatore giallo","Evidenziatore giallo",10,"0.95","Evidenziatore.jpg",,FALSO,FALSO,"SMR","N010",,
"CBP006","Italy","Penne, accessori","Evidenziatori, marcatori","Evidenziatore colori assortiti","Evidenziatore colori assortiti",6,"1.54","Evidenziatore-colori-assortiti-.jpg",,FALSO,FALSO,"SMR","N010",,
"CBP007","Italy","Penne, accessori","Evidenziatori, marcatori","Evidenziatore arancio","Evidenziatore arancio",10,"0.95","Evidenziatore.jpg",,FALSO,FALSO,"SMR","N010",,
"CBP008","Italy","Penne, accessori","Evidenziatori, marcatori","Evidenziatore blu","Evidenziatore blu",10,"0.95","Evidenziatore.jpg",,FALSO,FALSO,"SMR","N010",,
"CBP009","Italy","Penne, accessori","Evidenziatori, marcatori","Evidenziatore rosa","Evidenziatore rosa",10,"0.95","Evidenziatore.jpg",,FALSO,FALSO,"SMR","N010",,
"CBP010","Italy","Penne, accessori","Evidenziatori, marcatori","Marcatore perm. N50 p conica nero cf.12","Marcatore perm. N50 p conica nero cf.12",12,"9.45","Marcatore-perm.-N50-p-conica-cf.12.jpg",,FALSO,FALSO,"SMR","N010",,
"CBP011","Italy","Penne, accessori","Evidenziatori, marcatori","Marcatore perm. N50 p conica blu cf.12","Marcatore perm. N50 p conica blu cf.12",12,"9.45","Marcatore-perm.-N50-p-conica-cf.12.jpg",,FALSO,FALSO,"SMR","N010",,
"CBP012","Italy","Penne, accessori","Evidenziatori, marcatori","Marcatore perm. N50 p conica rosso cf.12","Marcatore perm. N50 p conica rosso cf.12",12,"9.45","Marcatore-perm.-N50-p-conica-cf.12.jpg",,FALSO,FALSO,"SMR","N010",,
"CBP013","Italy","Penne, accessori","Evidenziatori, marcatori","Marcatore perm. N50 p conica verde cf.12","Marcatore perm. N50 p conica verde cf.12",12,"8.99","Marcatore-perm.-N50-p-conica-cf.12.jpg",,FALSO,FALSO,"SMR","N010",,
"CBP014","Italy","Penne, accessori","Evidenziatori, marcatori","Marcatore Stabilo nero medio","Marcatore Stabilo nero medio",10,"6.30","Marcatore-Stabilo-nero-medio.jpg",,FALSO,FALSO,"SMR","N010",,
"CBP015","Italy","Penne, accessori","Evidenziatori, marcatori","Tratto Pen Fila rosso","Tratto Pen Fila rosso",12,"4.92","Tratto-Pen-Fila.jpg",,FALSO,FALSO,"SMR","N010",,
"CBP016","Italy","Penne, accessori","Evidenziatori, marcatori","Tratto Pen Fila nero","Tratto Pen Fila nero",12,"4.68","Tratto-Pen-Fila.jpg",,FALSO,FALSO,"SMR","N010",,
"CBP017","Italy","Penne, accessori","Evidenziatori, marcatori","Tratto Pen Fila blu","Tratto Pen Fila blu",12,"4.68","Tratto-Pen-Fila.jpg",,FALSO,FALSO,"SMR","N010",,
"CBP018","Italy","Penne, accessori","Evidenziatori, marcatori","Tratto Pen Fila verde","Tratto Pen Fila verde",12,"4.92","Tratto-Pen-Fila.jpg",,FALSO,FALSO,"SMR","N010",,
"CBP019","Italy","Penne, accessori","Evidenziatori, marcatori","Marcatore Elica nero","Marcatore Elica nero",12,"6.60","Marcatore-Elica.jpg",,FALSO,FALSO,"SMR","N010",,
"CBP020","Italy","Penne, accessori","Evidenziatori, marcatori","Marcatore Elica blu","Marcatore Elica blu",12,"6.60","Marcatore-Elica.jpg",,FALSO,FALSO,"SMR","N010",,
"CBP021","Italy","Penne, accessori","Evidenziatori, marcatori","Marcatore Elica rosso","Marcatore Elica rosso",12,"6.60","Marcatore-Elica.jpg",,FALSO,FALSO,"SMR","N010",,
"CBP022","Italy","Penne, accessori","Evidenziatori, marcatori","Marcatore Elica colori assortiti","Marcatore Elica colori assortiti",6,"4.65","Marcatore-Elica-colori-assortiti.jpg",,FALSO,FALSO,"SMR","N010",,
"CBP023","Italy","Penne, accessori","Evidenziatori, marcatori","Marcatore Stabilo nero superfine","Marcatore Stabilo nero superfine",10,"6.30","Marcatore-Stabilo-nero-superfine.jpg",,FALSO,FALSO,"SMR","N010",,
"CBP024","Italy","Penne, accessori","Evidenziatori, marcatori","Pennarello lumocolor permanent nero","Pennarello lumocolor permanent nero",10,"8.06","Pennarello-lumocolor-permanent-nero.jpg",,FALSO,FALSO,"SMR","N010",,
"CBP025","Italy","Penne, accessori","Matite, portamine, acc","Matita Noris HB 2","Matita Noris HB 2 (confezione da 12 pezzi)",12,"3.53","Matita-Noris-HB-2-(confezione-da-12-pezzi).jpg",,FALSO,FALSO,"SMR","N010",,
"CBP026","Italy","Penne, accessori","Matite, portamine, acc","Matita con gommino","Matita con gommino",12,"1.63","Matita-con-gommino.jpg",,FALSO,FALSO,"SMR","N010",,
"CBP028","Italy","Penne, accessori","Matite, portamine, acc","Portamine Elica 0,7","Portamine Elica 0,7",12,"4.20","Portamine-Elica-0,7.jpg",,FALSO,FALSO,"SMR","N010",,
"CBP030","Italy","Penne, accessori","Matite, portamine, acc","Astuccio mine Faber Castell 0,5mm","Astuccio mine Faber Castell 0,5mm",1,"0.26","Astuccio-mine-Faber-Castell-0,5mm.jpg",,FALSO,FALSO,"SMR","N010",,
"CBP031","Italy","Penne, accessori","Matite, portamine, acc","Gomma bianca Staedtler","Gomma bianca Staedtler",20,"8.02","Gomma-bianca-Staedtler.jpg",,FALSO,FALSO,"SMR","N010",,
"CBP032","Italy","Penne, accessori","Matite, portamine, acc","Matita 2HB","Matita 2HB",12,"0.85","Matita-2HB.jpg",,FALSO,FALSO,"SMR","N010",,
"CBP033","Italy","Penne, accessori","Matite, portamine, acc","Astuccio mine 0,7mm","Astuccio mine 0,7mm",1,"0.26","Astuccio-mine-0,7mm.jpg",,FALSO,FALSO,"SMR","N010",,
"CBP034","Italy","Penne, accessori","Matite, portamine, acc","Gomma bianca Elica","Gomma bianca Elica",1,"0.33","Gomma-bianca-Elica.jpg",,FALSO,FALSO,"SMR","N010",,
"CBP036","Italy","Penne, accessori","Penne sfera","Penna a sfera Bic Cristal nero p.media","Penna a sfera Bic Cristal nero p.media cf.50",50,"7.05","Penna-a-sfera-Bic-Cristal-p.media-cf.50.jpg",,FALSO,FALSO,"SMR","N010",,
"CBP037","Italy","Penne, accessori","Penne sfera","Penna a sfera Bic Cristal rosso p.media","Penna a sfera Bic Cristal rosso p.media cf.50",50,"4.99","Penna-a-sfera-Bic-Cristal-p.media-cf.50.jpg",,FALSO,FALSO,"SMR","N010",,
"CBP038","Italy","Penne, accessori","Penne sfera","Penna a sfera Bic Cristal blu p.media","Penna a sfera Bic Cristal blu p.media cf.50",50,"7.05","Penna-a-sfera-Bic-Cristal-p.media-cf.50.jpg",,FALSO,FALSO,"SMR","N010",,
"CBP045","Italy","Penne, accessori","Penne sfera","Penna a sfera Pentel Superb Blu (confezione da 12 pezzi)","Penna a sfera Pentel Superb Blu",12,"6.96","Penna-a-sfera-Pentel-Superb.jpg",,FALSO,FALSO,"SMR","N010",,
"CBP046","Italy","Penne, accessori","Penne sfera","Penna a sfera Pentel Superb Rosso (confezione da 12 pezzi)","Penna a sfera Pentel Superb Rosso",12,"6.96","Penna-a-sfera-Pentel-Superb.jpg",,FALSO,FALSO,"SMR","N010",,
"CBP047","Italy","Penne, accessori","Penne sfera","Penna a sfera Pentel Superb Nero (confezione da 12 pezzi)","Penna a sfera Pentel Superb Nero",12,"6.96","Penna-a-sfera-Pentel-Superb.jpg",,FALSO,FALSO,"SMR","N010",,
"CBP048","Italy","Penne, accessori","Penne sfera","Penna a sfera Pentel Superb Verde (confezione da 12 pezzi)","Penna a sfera Pentel Superb Verde",12,"6.84","Penna-a-sfera-Pentel-Superb.jpg",,FALSO,FALSO,"SMR","N010",,
"CBP052","Italy","Carta, buste","Blocchi, quaderni","Blocco A4 a quadretti 5mm","Blocco A4 a quadretti 5mm",5,"4.63","Blocco-A4-a-quadretti.jpg",,FALSO,FALSO,"SMR","N010",,
"CBP052","Italy","Penne, accessori","Penne sfera","Penna a sfera G2 scatto Pilot Blu (confezione da 12 pezzi)","Penna a sfera G2 scatto Pilot Blu",12,"11.70","Penna-a-sfera-G2-scatto-Pilot.jpg",,FALSO,FALSO,"SMR","N010",,
"CBP053","Italy","Carta, buste","Blocchi, quaderni","Blocco A5 a quadretti 5mm","Blocco A5 a quadretti 5mm",5,"2.57","Blocco-A5-a-quadretti.jpg",,FALSO,FALSO,"SMR","N010",,
"CBP053","Italy","Penne, accessori","Penne sfera","Penna a sfera G2 scatto Pilot Rosso (confezione da 12 pezzi)","Penna a sfera G2 scatto Pilot Rosso",12,"11.70","Penna-a-sfera-G2-scatto-Pilot.jpg",,FALSO,VERO,"SMR","N010",,
"CBP054","Italy","Carta, buste","Blocchi, quaderni","Quaderno A4 spirale a quadretti","Quaderno A4 spirale a quadretti",10,"9.50","Quaderno-A4-spirale-a-quadretti.jpg",,FALSO,FALSO,"SMR","N010",,
"CBP054","Italy","Penne, accessori","Penne sfera","Penna a sfera G2 scatto Pilot Nero (confezione da 12 pezzi)","Penna a sfera G2 scatto Pilot Nero",12,"11.70","Penna-a-sfera-G2-scatto-Pilot.jpg",,FALSO,FALSO,"SMR","N010",,
"CBP055","Italy","Carta, buste","Blocchi, quaderni","Blocco A4 bianco","Blocco A4 bianco",5,"4.90","Blocco-A4-bianco.jpg",,FALSO,FALSO,"SMR","N010",,
"CBP056","Italy","Carta, buste","Blocchi, quaderni","Blocco A4 a righe","Blocco A4 a righe",5,"4.63","Blocco-A4-a-righe.jpg",,FALSO,FALSO,"SMR","N010",,
"CBP056","Italy","Penne, accessori","Penne sfera","Penna sfera Pilot Extra broad nero","Penna sfera Pilot Extra broad nero",12,"10.32","Penna sfera Pilot Extra broad nero.jpg",,FALSO,FALSO,"SMR","N010",,
"CBP057","Italy","Carta, buste","Blocchi, quaderni","Quaderno A4 spirale a righe","Quaderno A4 spirale a righe",10,"9.50","Quaderno-A4-spirale-a-righe.jpg",,FALSO,FALSO,"SMR","N010",,
"CBP057","Italy","Penne, accessori","Penne roller","Penna Roller Hi-Tecpoint V5 0,5mm blu (confezione da 12 pezzi)","Penna Roller Hi-Tecpoint V5 0,5mm blu (cf12)",12,"13.80","Penna-Roller-Hi-Tecpoint-V5-0,5mm.jpg",,FALSO,FALSO,"SMR","N010",,
"CBP058","Italy","Penne, accessori","Penne roller","Penna Roller Hi-Tecpoint V5 0,5mm nero (confezione da 12 pezzi)","Penna Roller Hi-Tecpoint V5 0,5mm nero (cf12)",12,"13.80","Penna-Roller-Hi-Tecpoint-V5-0,5mm.jpg",,FALSO,FALSO,"SMR","N010",,
"CBP059","Italy","Carta, buste","Blocchi, quaderni","Tavoletta portablocco blu","Tavoletta portablocco blu",1,"1.68","tavoletta-portablocco.jpg",,FALSO,FALSO,"SMR","N010",,
"CBP059","Italy","Penne, accessori","Penne roller","Penna Roller Hi-Tecpoint V5 0,5mm rosso (confezione da 12 pezzi)","Penna Roller Hi-Tecpoint V5 0,5mm rosso (cf12)",12,"13.80","Penna-Roller-Hi-Tecpoint-V5-0,5mm.jpg",,FALSO,VERO,"SMR","N010",,
"CBP060","Italy","Carta, buste","Blocchi, quaderni","Tavoletta portablocco rosso","Tavoletta portablocco rosso",1,"1.68","tavoletta-portablocco.jpg",,FALSO,FALSO,"SMR","N010",,
"CBP060","Italy","Penne, accessori","Penne roller","Roller Bionic Worker blu","Roller Bionic Worker blu",10,"14.30","Roller-Bionic-Worker.jpg",,FALSO,FALSO,"SMR","N010",,
"CBP061","Italy","Carta, buste","Blocchi, quaderni","Quaderno monocromo A4 quadretti","Quaderno monocromo A4 quadretti",10,"5.80","Quaderno-monocromo-A4-A5-quadretti.jpg",,FALSO,FALSO,"SMR","N010",,
"CBP061","Italy","Penne, accessori","Penne roller","Roller Bionic Worker nero","Roller Bionic Worker nero",10,"14.30","Roller-Bionic-Worker.jpg",,FALSO,FALSO,"SMR","N010",,
"CBP062","Italy","Carta, buste","Blocchi, quaderni","Quaderno monocromo A4 righe","Quaderno monocromo A4 righe",10,"5.87","Quaderno-monocromo-A4-A5-righe.jpg",,FALSO,VERO,"SMR","N010",,
"CBP062","Italy","Penne, accessori","Penne roller","Roller Bionic Worker rosso","Roller Bionic Worker rosso",10,"14.30","Roller-Bionic-Worker.jpg",,FALSO,FALSO,"SMR","N010",,
"CBP063","Italy","Carta, buste","Blocchi, quaderni","Quaderno monocromo A5 quadretti","Quaderno monocromo A5 quadretti",10,"3.41","Quaderno-monocromo-A4-A5-quadretti.jpg",,FALSO,FALSO,"SMR","N010",,
"CBP063","Italy","Penne, accessori","Penne roller","Roller Bionic Worker verde","Roller Bionic Worker verde",10,"14.30","Roller-Bionic-Worker.jpg",,FALSO,FALSO,"SMR","N010",,
"CBP064","Italy","Carta, buste","Blocchi, quaderni","Quaderno monocromo A5 righe","Quaderno monocromo A5 righe",10,"3.41","Quaderno-monocromo-A4-A5-righe.jpg",,FALSO,FALSO,"SMR","N010",,
"CBP064","Italy","Penne, accessori","Refill","Refill Pelikan per stiloforo nero","Refill Pelikan per stiloforo nero",1,"0.71","Refill-Pelikan-per-stiloforo.jpg",,FALSO,FALSO,"SMR","N010",,
"CBP065","Italy","Carta, buste","Carta intestata","Risma di carta intestata SOL da 500 fogli (primo foglio)","Risma di carta intestata SOL da 500 fogli (primo foglio)",2,"80.00","risma_carta-intestata-sol.jpg",,FALSO,FALSO,"SMR","N010",,
"CBP065","Italy","Penne, accessori","Refill","Refill Pelikan per stiloforo blu","Refill Pelikan per stiloforo blu",1,"0.71","Refill-Pelikan-per-stiloforo.jpg",,FALSO,FALSO,"SMR","N010",,
"CBP066","Italy","Carta, buste","Carta intestata","Risma di carta intestata VIVISOL da 500 fogli (primo foglio)","Risma di carta intestata VIVISOL da 500 fogli (primo foglio)",2,"80.00","risma_carta-intestata-vivisol.jpg",,FALSO,FALSO,"SMR","N010",,
"CBP066","Italy","Carta, buste","Post-it","Notes 100 fg. 51X 76 giallo","Notes 100 fg. 51X 76 giallo (confezione da 12 pezzi)",12,"1.62","Notes-100-fg.-51X-76-giallo.jpg",,FALSO,FALSO,"SMR","N010",,
"CBP067","Italy","Carta, buste","Carta intestata","Carta intestata SOL fogli successivi","Carta intestata SOL fogli successivi",500,"80.00","risma_carta-seguito-sol.jpg",,FALSO,VERO,"SMR","N010",,
"CBP068","Italy","Carta, buste","Carta intestata","Carta intestata VIVISOL fogli successivi","Carta intestata VIVISOL fogli successivi",500,"80.00","risma_carta-seguito-vivisol.jpg",,FALSO,FALSO,"SMR","N010",,
"CBP068","Italy","Carta, buste","Post-it","Notes 100 fg. 38 X 51 giallo","Notes 100 fg. 38 X 51 giallo (confezione da 12 pezzi)",12,"0.96","Notes-100-fg.-38-X-51-giallo.jpg",,FALSO,FALSO,"SMR","N010",,
"CBP069","Italy","Carta, buste","Carta intestata","Carta intestata CTS fogli successivi","Carta intestata CTS fogli successivi",500,"25.00","risma_carta-seguito-CTS.jpg",,FALSO,FALSO,"SMR","N010",,
"CBP069","Italy","Carta, buste","Post-it","Notes 100 fg. 76 X 127 giallo","Notes 100 fg. 76 X 127 giallo",12,"2.68","Notes-100-fg.-76-X-127-giallo.jpg",,FALSO,FALSO,"SMR","N010",,
"CBP070","Italy","Carta, buste","Carta intestata","Carta intestata CTS primo foglio","Carta intestata CTS primo foglio",500,"25.00","risma_carta-intestata-CTS.jpg",,FALSO,FALSO,"SMR","N010",,
"CBP070","Italy","Carta, buste","Post-it","Notes 100 fg. 76X76 giallo","Notes 100 fg. 76X76 giallo (confezione da 12 pezzi)",12,"2.61","Notes-100-fg.-76X76-giallo.jpg",,FALSO,FALSO,"SMR","N010",,
"CBP071","Italy","Carta, buste","Carta stampanti, fax","A4 paper ream","Risma di carta A4 da 500 fogli",5,"11.50","Risma-di-carta-A4.jpg",,FALSO,FALSO,"SMR","N010",,
"CBP071","Italy","Carta, buste","Post-it","Post-it cubo 450 fogli giallo","Post-it cubo 450 fogli giallo",1,"0.97","Post-it-cubo-450-fogli-giallo.jpg",,FALSO,FALSO,"SMR","N010",,
"CBP072","Italy","Carta, buste","Carta stampanti, fax","A3 paper ream","Risma di carta A3 da 500 fogli",5,"24.30","Risma-di-carta-A3.jpg",,FALSO,FALSO,"SMR","N010",,
"CBP073","Italy","Carta, buste","Carta stampanti, fax","Risma di carta A4 riciclata","Risma di carta A4 riciclata da 500 fogli",5,"14.87","Risma-di-carta-A4_riciclata.jpg",,FALSO,FALSO,"SMR","N010",,
"CBP073","Italy","Carta, buste","Post-it","Notes 100 fg. 102 X 76 giallo","Notes 100 fg. 102 X 76 giallo",12,"2.31","Notes-100-fg.-102-X-76-giallo.jpg",,FALSO,FALSO,"SMR","N010",,
"CBP074","Italy","Carta, buste","Carta stampanti, fax","Risma di carta A4 bianca 160 gr da 250 fogli","Risma di carta A4 bianca 160 gr da 250 fogli",1,"7.33","Risma-di-carta-A4.jpg",,FALSO,FALSO,"SMR","N010",,
"CBP074","Italy","Carta, buste","Post-it","Post-it index 684 mini freccia","Post-it index 684 mini freccia",1,"3.81","Post-it-index-684-mini-freccia.jpg",,FALSO,FALSO,"SMR","N010",,
"CBP075","Italy","Carta, buste","Carta stampanti, fax","Risma di carta A3 bianca 160 gr da 500 fogli","Risma di carta A3 bianca 160 gr da 500 fogli",1,"8.15","Risma-di-carta-A3.jpg",,FALSO,FALSO,"SMR","N010",,
"CBP075","Italy","Carta, buste","Post-it","Post-it index 686 strong","Post-it index 686 strong",1,"4.47","Post-it-index-686-strong.jpg",,FALSO,FALSO,"SMR","N010",,
"CBP076","Italy","Carta, buste","Carta stampanti, fax","Risma di carta A4 bianca 100gr da 500 fogli","Risma di carta A4 bianca 100gr da 500 fogli",1,"5.00","Risma-di-carta-A4.jpg",,FALSO,FALSO,"SMR","N010",,
"CBP080","Italy","Carta, buste","Carta stampanti, fax","Modulo continuo 37.5x11 lettura facilitata","Modulo continuo 37.5x11 lettura facilitata",1,"21.03","Modulo-continuo.jpg",,FALSO,FALSO,"SMR","N010",,
"CBP081","Italy","Carta, buste","Fogli protocollo","Fogli protocollo a righe","Fogli protocollo a righe",200,"2.48","fogli-protocollo.jpg",,FALSO,FALSO,"SMR","N010",,
"CBP082","Italy","Carta, buste","Fogli protocollo","Fogli protocollo a righe per uso bollo","Fogli protocollo a righe per uso bollo",200,"2.61","fogli-protocollo-per-bollo.jpg",,FALSO,FALSO,"SMR","N010",,
"CBP083","Italy","Carta, buste","Buste a foratura univ.","Busta perf. univ. ppl lucida 13/100 22x30","Busta perf. univ. ppl lucida 13/100 22x30",50,"2.22","Busta-perforatura_univ.jpg",,FALSO,FALSO,"SMR","N010",,
"CBP084","Italy","Carta, buste","Buste a foratura univ.","Busta perf.univ.antir. 13/100 22x30","Busta perf.univ.antir. 13/100 22x30",50,"1.60","Busta-perforatura_univ.jpg",,FALSO,FALSO,"SMR","N010",,
"CBP085","Italy","Carta, buste","Buste a foratura univ.","Busta a L antiriflesso 13/100 22x30","Busta a L antiriflesso 13/100 22x30",50,"2.51","Busta-a-L-antiriflesso.jpg",,FALSO,FALSO,"SMR","N010",,
"CBP086","Italy","Carta, buste","Buste a foratura univ.","Busta perf. univ. 23x33","Busta perf.univ. 23X33",25,"3.56","Busta-perforatura_univ.jpg",,FALSO,FALSO,"SMR","N010",,
"CBP087","Italy","Carta, buste","Buste a foratura univ.","Busta perf.univ. a soffietto rinforzata 22x30","Busta perf.univ. a soffietto rinforzata 22x30",10,"6.36","Busta-perforatura_univ-a-soffietto_rinforzata.jpg",,FALSO,FALSO,"SMR","N010",,
"CBP095","Italy","Carta, buste","Buste a sacco avana","Buste avana 19x26 senza logo (500 pezzi)","Buste avana 19x26 senza logo",500,"16.63","buste-avana_piu-misure.jpg",,FALSO,FALSO,"SMR","N010",,
"CBP096","Italy","Carta, buste","Buste a sacco avana","Buste avana 23x33 senza logo (500 pezzi)","Buste avana 23x33 senza logo",500,"21.42","buste-avana_piu-misure.jpg",,FALSO,FALSO,"SMR","N010",,
"CBP097","Italy","Carta, buste","Buste a sacco avana","Buste avana 25x35 senza soffietto senza logo (500 pezzi)","Buste avana 25x35 senza soffietto senza logo",500,"25.12","buste-avana_piu-misure.jpg",,FALSO,FALSO,"SMR","N010",,
"CBP098","Italy","Carta, buste","Buste a sacco avana","Buste avana 25x35 con soffietto senza logo (500 pezzi)","Buste avana 25x35 con soffietto senza logo",500,"25.00","buste-avana_25x35-con-soffietto.jpg",,FALSO,FALSO,"SMR","N010",,
"CBP099","Italy","Carta, buste","Buste a sacco avana","Buste avana 19x26 con logo SOL","Buste avana 19x26 con logo SOL",1000,"130.00","buste-avana_25x35-con-soffietto_sol.jpg",,FALSO,FALSO,"SMR","N010",,
"CBP100","Italy","Carta, buste","Buste a sacco avana","Buste avana 23x33 con logo SOL (500 pezzi)","Buste avana 23x33 con logo SOL",500,"130.00","buste-avana_25x35-con-soffietto_sol.jpg",,FALSO,FALSO,"SMR","N010",,
"CBP101","Italy","Carta, buste","Buste a sacco avana","Buste avana 25x35 senza soffietto con logo SOL","Buste avana 25x35 senza soffietto con logo SOL",1000,"150.00","buste-avana_piu-misure_sol.jpg",,FALSO,FALSO,"SMR","N010",,
"CBP102","Italy","Carta, buste","Buste a sacco avana","Buste avana 25x35 con soffietto con logo SOL (500 pezzi)","Buste avana 25x35 con soffietto con logo SOL",1000,"150.00","buste-avana_piu-misure_sol.jpg",,FALSO,FALSO,"SMR","N010",,
"CBP103","Italy","Carta, buste","Buste a sacco avana","Buste avana 19x26 con logo VIVISOL (500 pezzi)","Buste avana 19x26 con logo VIVISOL",1000,"120.00","buste-avana_25x35-con-soffietto_vivisol.jpg",,FALSO,FALSO,"SMR","N010",,
"CBP104","Italy","Carta, buste","Buste a sacco avana","Buste avana 23x33 con logo VIVISOL (500 pezzi)","Buste avana 23x33 con logo VIVISOL",500,"130.00","buste-avana_25x35-con-soffietto_vivisol.jpg",,FALSO,FALSO,"SMR","N010",,
"CBP105","Italy","Carta, buste","Buste a sacco avana","Buste avana 25x35 senza soffietto con logo VIVISOL (500 pezzi)","Buste avana 25x35 senza soffietto con logo VIVISOL",500,"150.00","buste-avana_piu-misure_vivisol.jpg",,FALSO,FALSO,"SMR","N010",,
"CBP106","Italy","Carta, buste","Buste a sacco avana","Buste avana 25x35 con soffietto con logo VIVISOL (500 pezzi)","Buste avana 25x35 con soffietto con logo VIVISOL",1000,"150.00","buste-avana_piu-misure_vivisol.jpg",,FALSO,FALSO,"SMR","N010",,
"CBP107","Italy","Carta, buste","Buste commerciali","Buste bianche 11x23 senza logo senza finestra (500 pezzi)","Buste bianche 11x23 senza logo senza finestra",500,"7.79","buste-senza-finestra.jpg",,FALSO,FALSO,"SMR","N010",,
"CBP108","Italy","Carta, buste","Buste commerciali","Buste bianche 11x23 senza logo con finestra (500 pezzi)","Buste bianche 11x23 senza logo con finestra",500,"7.79","buste-con-finestra.jpg",,FALSO,FALSO,"SMR","N010",,
"CBP109","Italy","Carta, buste","Buste commerciali","Buste bianche 11x23 con logo SOL senza finestra","Buste bianche 11x23 con logo SOL senza finestra",1000,"70.00","buste-senza-finestra_sol.jpg",,FALSO,FALSO,"SMR","N010",,
"CBP110","Italy","Carta, buste","Buste commerciali","Buste bianche 11x23 con logo VIVISOL senza finestra","Buste bianche 11x23 con logo VIVISOL senza finestra",1000,"70.00","buste-senza-finestra_vivisol.jpg",,FALSO,FALSO,"SMR","N010",,
"CBP111","Italy","Carta, buste","Buste commerciali","Buste bianche 11x23 con logo SOL con finestra","Buste bianche 11x23 con logo SOL con finestra",1000,"70.00","buste-con-finestra_sol.jpg",,FALSO,FALSO,"SMR","N010",,
"CBP112","Italy","Carta, buste","Buste commerciali","Buste bianche 11x23 con logo VIVISOL con finestra (500 pezzi)","Buste bianche 11x23 con logo VIVISOL con finestra",1000,"70.00","buste-con-finestra_vivisol.jpg",,FALSO,FALSO,"SMR","N010",,
"CBP114","Italy","Carta, buste","Buste imbottite","Busta imbottita tipo B 12x21","Busta imbottita tipo B 12x21",10,"1.10","Busta-imbottita_vari-modelli.jpg",,FALSO,FALSO,"SMR","N010",,
"CBP115","Italy","Carta, buste","Buste imbottite","Busta imbottita tipo C 14x21","Busta imbottita tipo C 14x21",10,"1.30","Busta-imbottita_vari-modelli.jpg",,FALSO,FALSO,"SMR","N010",,
"CBP116","Italy","Carta, buste","Buste imbottite","Busta imbottita tipo D 18x26","Busta imbottita tipo D 18x26",10,"1.50","Busta-imbottita_vari-modelli.jpg",,FALSO,FALSO,"SMR","N010",,
"CBP117","Italy","Carta, buste","Buste imbottite","Busta imbottita tipo E 22x26","Busta imbottita tipo E 22x26",10,"1.90","Busta-imbottita_vari-modelli.jpg",,FALSO,FALSO,"SMR","N010",,
"CBP118","Italy","Carta, buste","Buste imbottite","Busta imbottita tipo H 27x36","Busta imbottita tipo H 27x36",10,"2.10","Busta-imbottita_vari-modelli.jpg",,FALSO,FALSO,"SMR","N010",,
"CBP119","Italy","Carta, buste","Buste imbottite","Busta imbottita tipo J 30x44","Busta imbottita tipo J 30x44",10,"2.40","Busta-imbottita_vari-modelli.jpg",,FALSO,FALSO,"SMR","N010",,
"CBP120","Italy","Carta, buste","Buste imbottite","Busta imbottita tipo K 35x48","Busta imbottita tipo K 35x48",10,"3.80","Busta-imbottita_vari-modelli.jpg",,FALSO,FALSO,"SMR","N010",,
"CBP121","Italy","Carta, buste","Buste imbottite","Busta imbottita tipo F/G 23x33","Busta imbottita tipo F/G 23x33",10,"1.40","Busta-imbottita_vari-modelli.jpg",,FALSO,FALSO,"SMR","N010",,
"CBP126","Italy","Carta, buste","Blocchi, risme carta","Etichette adesive 70X32 27 etichette per foglio","Etichette adesive 70X32 27 etichette per foglio",1,"9.53","Etichette-adesive.jpg",,FALSO,VERO,"SMR","N010",,
"CBP127","Italy","Carta, buste","Blocchi, risme carta","Etichette adesive 70X36 24 etichette per foglio","Etichette adesive 70X36 24 etichette per foglio",1,"9.53","Etichette-adesive.jpg",,FALSO,VERO,"SMR","N010",,
"CBP128","Italy","Carta, buste","Blocchi, risme carta","Etichette adesive 105X37 16 etichette per foglio","Etichette adesive 105X37 16 etichette per foglio",1,"9.53","Etichette-adesive.jpg",,FALSO,VERO,"SMR","N010",,
"CBP129","Italy","Carta, buste","Blocchi, risme carta","Etichette adesive 105X48 12  etichette per foglio","Etichette adesive 105X48 12  etichette per foglio",1,"9.53","Etichette-adesive.jpg",,FALSO,VERO,"SMR","N010",,
"CBP130","Italy","Carta, buste","Blocchi, risme carta","Etichette adesive 105X74 8 etichette per foglio","Etichette adesive 105X74 8 etichette per foglio",1,"9.53","Etichette-adesive.jpg",,FALSO,VERO,"SMR","N010",,
"CBP131","Italy","Carta, buste","Blocchi, risme carta","Etichette adesive 105X148 4 etichette per foglio","Etichette adesive 105X148 4 etichette per foglio",1,"9.53","Etichette-adesive.jpg",,FALSO,VERO,"SMR","N010",,
"CBP132","Italy","Carta, buste","Blocchi, risme carta","Etichette adesive 210X148 2 etichette per foglio","Etichette adesive 210X148 2 etichette per foglio",1,"9.53","Etichette-adesive.jpg",,FALSO,VERO,"SMR","N010",,
"CBP133","Italy","Carta, buste","Blocchi, risme carta","Etichette adesive 210X297 1 etichette per foglio","Etichette adesive 210X297 1 etichette per foglio",1,"9.53","Etichette-adesive.jpg",,FALSO,VERO,"SMR","N010",,
